<?xml version="1.0" encoding="UTF-8"?>
<cv24:cv24 xmlns:cv24="http://univ.fr/cv24" xmlns:xsi="http://www.w3.org/2001/XMLSchema-instance" xsi:schemaLocation="http://univ.fr/cv24 cv24.tp1.xsd ">
  <cv24:identite>
    <genre>M.</genre>
    <nom>N</nom>
    <prenom>prenom</prenom>
    <tel>+33 1 23 45 67 89</tel>
    <mel>mel@hs.fr</mel>
  </cv24:identite>
  <cv24:objectif status="stage">
  <objectif>test
  </objectif>
  </cv24:objectif>
  <cv24:prof>
    <detail>
      <datedeb>2001-01-01</datedeb>
      <datefin>2001-01-01</datefin>
      <titre>titre</titre>
    </detail>
    
  </cv24:prof>
  <cv24:competences>
    <diplÃ´me niveau="1">
      <date>2001-01-01</date>
      <institut>institut</institut>
      <titre>titre</titre>

      
    </diplÃ´me>
    
    
    <certif>
      <datedeb>2001-01-01</datedeb>
      <datefin>2001-01-01</datefin>
      <titre>titre</titre>
      
    </certif>
    
    
    
  </cv24:competences>
  
  <cv24:divers>
    <lv cert="MAT" lang="fr"/>
    
    <autre titre="ss" comment="tets"/>
  </cv24:divers>
</cv24:cv24>
