<?xml version="1.0" encoding="UTF-8"?>
<cv24:cv24 xmlns:cv24="http://univ.fr/cv24" xmlns:xsi="http://www.w3.org/2001/XMLSchema-instance" xsi:schemaLocation="http://univ.fr/cv24 cv24.tp1.xsd">
    <cv24:identite>
		<genre>M.</genre>
        <nom>RAYANE</nom>
        <prenom>Rayane</prenom>
        <tel>0345678901</tel>
        <mel>rayane@example.com</mel>
    </cv24:identite>
    <cv24:objectif status="emploi">
      <objectif>Journaliste multimedia specialise dans les affaires internationales</objectif>

    </cv24:objectif>
    <cv24:prof>
       <detail>
            <datedeb>2013-07-01</datedeb>
            <datefin>2021-07-01</datefin>
            <titre>Redacteur en chef</titre>
        </detail>
    </cv24:prof>
    <cv24:competences>
        <diplôme niveau="6">
        <date>2013-06-15</date>
            <institut>Ecole de Journalisme de Paris</institut>
            <titre>Master en Journalisme</titre>
        </diplôme>
        <certif>
             <datedeb>2015-10-01</datedeb>
            <titre>Certification en Journalisme </titre>
        </certif>
    </cv24:competences>
    <cv24:divers>
      <lv lang="Français" nivs="C1" cert="MAT" nivi="900"/>
        <autre titre="Photographie" comment="Expositions photographiques sur les cultures du monde"/>
  </cv24:divers>
</cv24:cv24>