<?xml version="1.0" encoding="UTF-8"?>
<cv24:cv24 xmlns:cv24="http://univ.fr/cv24" xmlns:xsi="http://www.w3.org/2001/XMLSchema-instance" xsi:schemaLocation="http://univ.fr/cv24 cv24.tp1.xsd">
      <cv24:identite>
        <genre>Miss</genre>
        <nom>KHICHA</nom>
        <prenom>Ines</prenom>
        <tel>07 68 74 15 95</tel>
    </cv24:identite>
    <cv24:objectif status="stage">
        <objectif>ABCDefé&amp;@;:;$#*</objectif>
    </cv24:objectif>
    <cv24:competences>
        <diplôme niveau="3">
            <date>2021-12-12</date>
            <titre>LicenceséàL</titre>
        </diplôme>
    </cv24:competences>
</cv24:cv24>