<?xml version="1.0" encoding="UTF-8"?>
<cv24:cv24 xmlns:cv24="http://univ.fr/cv24" xmlns:xsi="http://www.w3.org/2001/XMLSchema-instance" xsi:schemaLocation="http://univ.fr/cv24 cv24.tp1.xsd">
    <cv24:identite>
        <genre>Miss</genre>
        <nom>TIRECHE</nom>
        <prenom>Amira</prenom>
        <tel>0987654321</tel>
        <mel>ammira.tirreche@example.com</mel>
    </cv24:identite>
    <cv24:objectif status="stage">
        <objectif>Etudiante en Master de Génie logiciel cherchant un stage d'été</objectif>
    </cv24:objectif>
    <cv24:prof>
        <detail>
            <datedeb>2021-06-01</datedeb>
            <datefin>2021-08-31</datefin>
            <titre>Stagiaire en développement internationales</titre>
        </detail>
    </cv24:prof>
    <cv24:competences>
        <diplôme niveau="5">
            <date>2021-09-01</date>
            <institut>Faculte d'informatique de Paris</institut>
            <titre>Master en Informatique</titre>
        </diplôme>
            <certif>
            <datedeb>2019-05-01</datedeb>
            <titre>Certification en DevOps </titre>
        </certif>
    </cv24:competences>
    <cv24:divers>
        <lv lang="Espagnol" nivs="A2" cert="TOEIC" />
        <autre titre="Benevolat" comment="Participation a des projets humanitaires en Amerique Latine"/>
    </cv24:divers>
</cv24:cv24>